子供 たち が 公園 で 遊 ん で い た 。,11
先生 は 怒 っ て い る よう だっ た 。,11
一人 で 大勢 は 助け られ な い が 、 大勢 は 一人 が 助け られ る 。,18
その 法律 は もう 実施 さ れ て い な い 。,12
いつ どこ で あの 古 時計 を 買 っ た の で す か 。,15
出火 の 際 は 、 すぐ に １１９ 番 に 電話 し な けれ ば な ら な い 。,20
彼女 は 優雅 だ 。,5
株主 たち は もうけ まく っ て い ま す 。,11
机 の 上 に 本 が あ り ま す 。,11
彼女 は とても 行 き たが っ て い る 。,11
私 は 彼 を 大いに 尊敬 し て い ま す 。,12
その 勝利 で 私 たち の チーム は 意気 が 上が っ た 。,14
彼 は すべて の 少年 の 中 で 一番 背 が 高 い 。,14
彼 が 死 ん で 三 年 た っ た 。,11
奴 が 一人 で うま い 汁 を 吸 い やが っ た 。,14
雨 の あと 、 道路 に 水溜まり が でき た 。,11
鳥 が 木 の 上 で 歌 っ て い る 。,12
君 が 外 を 見 られ る よう カーテン を 開け て あげ よう 。,15
彼 は 文章 が うま い 。,7
次 の 会議 の 通知 が ドア に 掲示 さ れ て い た 。,15
たいてい の 病院 で は カルテ は アルファベット 順 に 保管 さ れ て い る 。,17
長 い 長 い 時 が 過ぎ た 。,9
ローン が ふくら み そう な 気配 を 見せ て い ま す ね 。,15
僕 は そっち より こっち の 方 が お と っ て い る と 思 う 。,18
私 は 彼女 の カクテル パーティー に 行 く 予定 で す 。,13
彼 の 名 は この 町 の 誇り で あ る 。,12
計画 は うま く い っ た 。,8
どう し て も 治 し た い の で す 。,12
試験 で 答え を 書 く とき は 注意 し な けれ ば な ら な い 。,18
予想 外 の 事態 に 人々 は 困惑 し た 。,11
左 に 曲が れ ば 、 郵便 局 が 見え る 。,12
天候 は 、 世界 の 至 る 所 で 、 植物 界 と 下等 動物 界 の 間 の 複雑 な 調和 状態 に 影響 を 与え て い る 。,31
私 は その クラブ に 入会 し た い 。,10
マユコ は いつ も 完璧 を 目指 し て い る 。,12
その 木 は 屋根 と 同じ ぐらい の 高 さ だ 。,12
水 が 腰 まで 来 た 。,7
それ は 彼女 の で す ね 。,8
あなた は いつ 私 に 会 い に 来 ま す か 。,13
あなた の 郵便 物 を 間違 っ て 開け て しま っ て 申し訳 あ り ま せ ん 。,20
私 は 彼 が 何者 な の か はっきり と は 知 ら な い 。,16
痛 い 。 蜂 に 刺 さ れ た 。,10
彼 ら は 海 の 眺め が 美し い 場所 を 買 っ た 。,15
商売 は 先月 ちょっと 不調 だっ た 。,8
この 箱 の 蓋 は どう し て も 開 か な い 。,14
完全 に は 治 り ま せ ん 。,9
人 は それぞれ 異な る 道 を 進 ん で も 、 行き着 く 先 は 一 つ だ 。,20
弾丸 は 彼 の 厚 い 胸板 を 貫通 し た 。,12
ひょっと し て 彼女 は 答え を 知 っ て い る の か も しれ な い 。,19
どう やら 、 さっき の は 演技 で は な く 、 素 だっ た らし い 。,18
彼女 は 莫大 な 財産 を 持 っ て い て 暮らし 向き が よ い 。,17
もし お 金 が あ れ ば 、 その カメラ が 買え る の だ が 。 実 の ところ は 買え な い 。,25
私 は ほとんど 用意 が 出来 て い る 。,10
この 間 ミュージカル に 見 に 行 っ た ん だ けど 、 前 から ３ 列 目 で さ 、 もう 憧れ の 人 が 目 の 前 で 、 もう 最高 だっ た ね 。 一段 と 彼 を 好き に な っ た 。,47
その 男の子 は 泣 き 始め ま し た 。,10
彼 は 命 を かけ て その 子供 を 救 っ た 。,13
私 は ほとんど お 金 を 持 っ て い な い 。,13
彼 の 収入 は 私 の ３ 倍 だ 。,10
彼女 は その 問題 が 重大 で あ る こと を 指摘 し た 。,15
当時 その 宗教 は 全盛 だっ た 。,8
私 は 彼 に 直接 会 っ た こと は あ り ま せ ん 。 で も 、 彼 の こと は 知 っ て い ま す 。,30
予想 は 、 寸分 違 わ ぬ くらい 当 っ た 。,12
私 達 が いつ 病気 に な る か わか り ま せ ん 。,15
彼女 は 子供 の ころ 病弱 だっ た らし い 。,11
ジム の 両親 は 彼 が スーザン と 結婚 する の に 賛成 し た 。,16
仕事 は ８ 時 まで に は おわ る だ ろ う 。,13
彼 ら に は 長 い 間 彼 から 便り が 無 い 。,14
よ い 食べ物 と 十分 な 睡眠 は 健康 に と っ て 絶対 に 必要 だ 。,18
彼女 は 野望 に 燃え て い た 。,9
私 は 来週 の 水曜 日 まで に レポート を 提出 し な けれ ば な ら な い 。,20
その 演説 は 大喝采 を も っ て 歓迎 さ れ た 。,13
お 茶 と コーヒー で は どちら が 好き で す か 。,13
ここ 数 年 で 事故 の 数 は 増え た 。,11
私 に は 京都 に 住 ん で い る 叔父 が い ま す 。,16
ジョン は フランス 語 が 上手 に 話せ ま せ ん 。,12
何 時 に 出かけ ま す か 。,8
ＯＫ ！ ！ ブラザー ！ ！ それ 以上 聞 き た く な い ぜ ！,16
この カプセル は 食後 ３０ 分 以内 に 飲 ん で くださ い 。,14
ありがとう 、 私 も 元気 で す 。,8
言 う こと と する こと は 別 だ 。,10
だれ と で も 仲良く や っ て 行 く よう に 努力 し な けれ ば な ら な い 。,22
彼 を はるばる 訪ね て 行 っ た が あいにく 不在 だっ た 。,14
彼 は 世 に も まれ な 大 詩人 で あ る 。,13
彼 は 抜群 の 騎手 だ 。,7
あなた が 私 の 家族 に し て 下さ っ た こと に たいへん 感謝 し ま す 。,19
われわれ は 彼 に 記者 団 と 会 う よう に 求め た が 、 拒否 し た 。,19
この 綿 の シャツ は 洗濯 が よく 効 く 。,11
目的 を 達成 する ため に 、 我々 は 協力 し た よ 。,14
赤 尽くめ の 人 は 銃 を 構え て い た 。,12
彼 は 車 に 引 か れ て 即死 し た 。,12
雨 が 降 れ ば 家 に い る 。,10
どの くらい 英語 を 勉強 し て い ま す か 。,12
昨日 田中 さん と い う 人 が 、 あなた に 会 い に き ま し た よ 。,20
彼 は 交通 信号 機 の 上 の カメラ に 気 が つ か な かっ た 。,18
私 の 家 は 丘 の 上 に 建 っ て い ま す 。,15
円高 は 日本 の 輸出 産業 に 逆 効果 に な っ て い る 。,16
加盟 国 中 数 カ国 は 、 Ｇ ７ の 協定 に 従 う こと に あいまい な 態度 を 見せ て い ま す 。,26
彼 は 冒険 好き だ 。,6
病院 の 後ろ に あ る あ の 建物 は なん で す か 。,15
悪ふざけ を する と 女の子 に 嫌 わ れ る よ 。,12
日本 の 漫画 は 大 規模 な ブーム を 起こ し た 。,13
なんて 変 な 天気 で しょ う 。,8
彼 は 明日 の 午後 に 来る か も 知れ ま せ ん 。,14
彼女 は 結局 、 現れ な かっ た 。,9
私 の 趣味 の 一 つ は クラッシック 音楽 で す 。,12
車内 の 彼 の 周り で は 、 ほか の 乗客 たち が 前後 左右 に 揺れ て い た 。,21
この 夏 に 故郷 を 訪問 し た とき 、 １０ 年 前 と は 違 う こと が わか っ た 。,23
私 の ビジネス は 再び 回復 し つつ あ り ま す 。,13
私 は 明日 まで に その 仕事 を 終え な けれ ば な ら な い 。,17
贈り物 は 普通 親切 な もてなし の お 返し に な さ れ る 。,15
これ ら の 本 の 中 の どれ で も 、 あなた の 役 に 立 つ で しょ う 。,21
彼女 は 今 頃 その 村 に 着 い て い る と 思 う 。,16
私 は 絶え ず 人 の 名前 を 忘れ て 困 る 。,13
彼 は やりくり 算段 の 生活 を し て い る に ちがい な い 。,16
この 牛乳 は すっぱ い 味 が する 。,9
驚 い た こと に 、 彼 は 歌 が 上手 かっ た 。,14
下水 が 完全 に 詰ま っ て い る 。,10
本当 は 、 彼 は い い やつ な ん だ 。,12
甥 と は 兄弟 か 姉妹 の 息子 の こと で す 。,13
彼女 は 一生 独身 で 通 し た 。,9
火事 で ４ 世帯 が 焼死 し た 。,9
私 は 長年 議長 を 務め て き た の で 、 もう そろそろ 引退 し よう か と 思 っ て い る 。,25
その 成功 で 彼 は 希望 に 燃え た 。,10
この 悲劇 の 本当 の 原因 は 何 で す か 。,12
私 は ジョン の 車 の ほう が 社長 の より 好き だ 。,14
タバコ を 吸 っ て も かま い ま せ ん か 。,13
や っ て み れ ば 旨 く 行 く よ 。,12
この 通り に 車 を 駐車 さ せ て は いけ な い 。,14
父 は 私 が 車 を 運転 する の を 許 さ な い 。,15
彼 ら は 嵐 を 警戒 し て い た 。,11
他人 に は 親切 に し なさ い 。,9
彼女 は 彼 が 正直 で あ る と 納得 し た 。,13
彼 は 来 れ ば 必ず 人 の 悪口 を 言 う 。,13
ミスプリント の な い よう な 本 は ほとんど な い 。,12
喜 ん で お 申し出 を お 受け し ま す 。,12
車 を 返却 し た い の で す が 。,11
呼 ん で いただ き ま し て ありがとう ござ い ま す 。,14
この 芝居 は ２ つ の 短 い 場面 で 構成 さ れ て い る 。,17
私 は 彼 を 馬鹿 に し た 。,9
「 彼 は すぐ 帰 っ て き ま す か 」 「 すぐ に は 帰 ら な い と 思 い ま す 」,26
当然 の こと と し て あなた 自身 が そこ へ 行 か な けれ ば な ら な い 。,21
もう ２ 時間 も 待 っ た 、 これ 以上 は 待て な い 。,15
男の子 で 食べ物 に うるさ い の は 少な い 。,11
ベン は 見かけ ほど 若 く な い 。,9
彼 は 故郷 から 遠 く 離れ て 住 ん で い る 。,14
ウエスト 夫人 は 朝食 の 用意 で 忙し い 。,10
鉄道 が この 街 に 敷設 さ れ た 。,10
彼女 は 彼 の 隠れ 場所 を 警察 に 密告 し た 。,13
彼女 は 興奮 し て い る よう に 見え た 。,12
あなた は 来年 アメリカ へ 行 く つもり で す か 。,12
遠慮 な く 意見 し て や る ぞ 。,10
きのう に な っ て やっと 彼 は 借金 を 払 っ た 。,14
初め の 一 歩 が 唯一 の 難関 。,9
チェックポイント を 教え て くださ い 。,7
１８ 世紀 の 後半 に は 、 アメリカ 人 の パスポート は 通常 、 合衆 国 大統領 に よ っ て 署名 さ れ て い た 。,28
この 語 の アクセント は どこ に あ る か 。,11
明日 は 又 暑 く な る の で しょ う か 。,13
私 だけ で な く 彼 も パーティー に 招待 さ れ て い る 。,16
その 病気 が 急速 に 広が る の を 防 ぐ の は 容易 な 事 で は な かっ た 。,22
彼 は 、 ゴマ すり だ 。,7
５ 分 待 つ か 待 た な い うち に バス が き た 。,16
誰 に 送 る の ？,6
君 が 座 っ て い る 腰掛け の ペンキ は まだ 塗り立て だ よ 。,16
最初 メグ は 、 家 が 恋し かっ た 。,10
マーガレット は 音楽 の 才 が あ る 。,9
彼女 は ピアノ で 歌手 の 伴奏 を し た 。,11
その 話 は 彼 自身 の 体験 に 基づ い て い る 。,14
電車 の 中 を 子供 が ウロチョロ し て い て 不 愉快 だっ た 。,16
「 足挫 い て て 歩け な い だ ろ ？ 」 「 いえ っ 、 平気 で す ！ 匍匐 前進 だっ た ら 進め ま す ！ 」,30
彼女 は 面 と 向か っ て 夫 を 罵 っ た 。,13
彼女 の 息子 は 、 まだ 少年 の ころ に 癌 で 死 ん だ 。,16
安全 手順 を 守 ら な い と けが し ま す よ 。,14
私 は ８ 年 前 に 結婚 し ま し た 。,12
彼 は 私 に すぐ に 金 を 払 う よう に 要求 し た 。,16
彼女 は 決して 学校 に 遅れ た 事 が な い 事 を 誇り に し て い る 。,20
卵 の 殻 は 壊れ やす い 。,8
霜 が 花 を いため た 。,7
彼女 は 来 な い か も しれ な い 。,11
私 に １ 杯 の 水 を 下さ い 。,10
音楽 を 聴 き ま す 。,7
彼 等 は いつ も 食べ る 物 に 困 っ て い る 。,15
私 たち は 君 の 提案 に 賛成 し よう 。,11
僕 の い う こと を 信 じ な い の なら 、 自分 で 行 っ て み て ごらん 。,22
空気 に 重 さ が あ る 、 と い う 考え は その 子 に は びっくり する よう な こと だっ た 。,25
消 し て お い て 。,7
時計 が 欲し い の で す か と 私 は 彼 に 言 っ た 。,17
スコットランド で は ９ 月 は とても 暑 く な る こと が あ る 。,16
学校 の 中 の 話 を 外 で する な 。,11
ここ で 靴 を 脱 が な けれ ば な り ま せ ん か 。,16
絶望 的 な 戦い の 中 、 貴君 の 師団 が 善戦 し た こと は 高 く 評価 さ れ て い る 。,25
君 は もっと 気 を つけ る べ き だっ た 。,12
会議 に 出席 し た 人 は ほとんど い な かっ た 。,13
私 は そんな ばか な こと は し な い こと に 決め た 。,15
彼 は 私 の 昔 から の 友達 で す 。,11
彼 は 紳士 どころ で は な い 。,9
その 誤り を 犯 し た の は 私 の 兄 だっ た 。,14
強 い 風 が １ 日 中 吹 い た 。,11
つかま る と いけ な い と 思 っ て 逃げ た 。,13
ホワイト 先生 は トム に 放課 後 居残 る よう に 命令 し た 。,15
外用 のみ に 使用 し 、 内服 し な い で 下さ い 。,14
国民 は 新し い 政府 を 作 っ た 。,10
私 は 出来 る だけ トンネル を 避け る よう に し ま す 。,15
飛行 機 で 行 く の で す か 、 それ と も 電車 で す か 。,18
東京 と 神戸 で は どちら が 大き い で す か 。,13
彼 は 前途 有望 で す 。,7
食事 中 に 音 を 立て る の は 無 作法 で す 。,14
私 は 疲れ て い た けど 、 働 い て い た 。,14
副 作用 は あ り ま せ ん か 。,10
彼 か 私 か の どちら か が その 会合 に 出席 し な けれ ば な ら な い 。,21
母 は ただただ 泣 く だけ だっ た 。,9
い い 線 い っ て い ま す よ 。,11
ケン と けんか し た の か 。,8
彼 は 絶え ず 他人 の 悪口 ばかり 言 っ て い る 。,14
どう や っ て 時間 を つぶ そう ？,9
あなた は ノア の 箱舟 を 知 っ て い ま す か 。,14
モスクワ の 冬 は 寒 い から 帽子 を かぶ っ た ら い い よ 。,17
すべて の こと を 私 に 任せ て くださ い 。,11
ここ の 気候 は 温暖 で あ る 。,9
彼女 は 医者 に な る で しょ う 。,10
私 が 冷凍 庫 を 持 つ 十分 な 理由 が いく つ か あ る 。,17
柔らか い 便 が 出 ま す 。,8
あの 男 を 説き伏せ よう と する の は 、 オオカミ に 道理 を 説 い て 聞 か せ る よう な もの だ 。,26
この 荷物 は あの 荷物 の ３ 倍 以上 の 重 さ だ 。,14
万一 考え を 変え る こと が あ っ た ら 、 私 に 知 ら せ て 下さ い 。,21
あなた は ポップ ソング が 好き で は な い の で す ね ？,15
彼女 の 言葉 は 次 の 通り だっ た 。,10
彼 は 不 動産 を 子供 達 に 譲 っ た 。,12
ジェーン は デート の 相手 が チョコレート ケーキ を すっかり 平らげ た の に は 驚 い た 。,19
父 は ６０ 歳 で 退職 する で しょ う 。,11
コンサート は 、 歌手 が 病気 の ため 翌週 まで 延ば さ れ た 。,15
２ 年 と は 、 待 つ に は 長 い 時間 だ 。,14
概し て 言 え ば 、 アメリカ 人 は とても コーヒー が 好き だ 。,15
彼女 は ターナー の 絵 を 所有 し て い る 。,12
彼 が 来 たら あなた の 伝言 を 伝え て お き ま す 。,15
私 は 彼 に お 金 を 貸 し た 。,11
私 は アルバム が ほし い 。 いく つ か 見せ て くださ い 。,15
明日 、 叔父 さん と 会 う 約束 が あ る 。,12
彼 に 休 む よう 忠告 し た 。,9
宿題 は 終わ っ た ん で す か 。,10
彼 は とても よ い 質問 を し た 。,10
私 は 以前 に 彼女 と 会 っ た 事 が 無 い 事 を 確信 し た 。,19
気楽 な やつ だ な 。,6
ポット に あまり 砂糖 が な かっ た 。,9
彼 は 悪 い 風邪 を わずら っ た 。,10
決め た ！ 今晩 彼 を デート に 誘 う わ 。,12
私 の 兄 は 私 の ２ 倍 も 食べ る 。,12
たとえ 両親 が 反対 し て も 私 は 留学 し た い 。,14
私 が 怒 っ た の で 事態 が 更に 悪化 し た 。,14
あやは ホット ピンク や 電子 ブルー や 深紫 と い っ た 激し い 色 が 好き だ 。,19
彼 の 言 っ た 事 は 、 ひど く 私 を 傷つけ た 。,15
私 は 先日 その お 店 で すばらし い 掘り出 し 物 を し た 。,16
彼 は その 家 を 購入 する 目的 で 調べ に 来 た 。,14
それ は ５ 日間 で 大丈夫 で す 。,9
父 は 税金 の 計算 を し て い る 。,11
約束 を 破 っ て は いけ な い 。,10
しかし 、 彼女 が すぐ に プレゼント を 捨て て しま っ て 、 彼 は 傷つ き ま し た 。,22
何事 で あ ろ う と も 、 忍耐 し な く て は な ら な い 。,19
彼 は とても 背 が 高 い 。,8
要 する に 金 が 必要 な ん だ 。 貸 し て く れ よ ！,17
私 たち は 、 爆発 の 音 を 聞 き 、 その 家 が 急 に 炎 に 包 ま れ る の を 見 た 。,27
真相 は 間 も な く 明らか に な る だ ろ う 。,14
そんな こと を すれ ば 、 失礼 な 人 だ と 思 わ れ ま す よ 。,18
彼女 は 嘘 を つ い た と 言 っ て 私 を 非難 し た 。,17
ジム は 英語 で は 級友 の 誰 より も 優れ て い ま す 。,16
我々 の 知 る 限り で は 彼 は 有罪 だ 。,12
彼女 は ２０ 歳 を 超え て い る はず が な い 。,14
交通 事故 が 幹線 道路 で 起こ っ た 。,10
あなた は 私 の 自慢 の 宝物 で す 。,10
今日 の 体調 は どう で す か 。,9
彼 は 今朝 から ずっと 詩 を 書 い て い る 。,13
私 は 新し い 女中 が たいへん 気 に 入 っ て い る 。,15
全 国民 が 平和 を 望 ん で い る 。,11
彼 は 自分 の 父 は 先生 だ と 私 に 言 っ た 。,15
誰 も 人前 で から か わ れ る の を 好 ま な い 。,16
お じい さん が 彼 に 、 その 高 い おもちゃ を 買い与え た 。,15
私 達 は ピクニック に 行 く の が 大好き で す 。,13
私 は 旅行 を 楽しみ に し て い る 。,11
与え る べ き 何もの も 持 た な い 心 は 感じ取 る べ き もの を 殆ど 見出 さ な い 。,24
それ は 不思議 な 事件 だっ た 。,8
その 課 の 復習 を し ま し た か 。,11
彼女 に は 関わり合い に な り た く な かっ た 。,13
本当 さ 。 信 じ た 方 が い い ぜ 。,12
彼 は 借金 の 支払い を 要求 し た 。,10
あなた の 写真 を 見せ て くださ い 。,9
彼 は しっかり と し た 握手 を する 。,10
その 雑誌 は どこ で 買え ま す か 。,10
綱 は 張 り すぎ て 切れ た 。,9
明日 、 彼 は あなた を 訪問 し な い で しょ う 。,14
その 時 以来 彼 から 何 の 便り も な い 。,12
弟 は 小 学校 へ 通 っ て い ま す 。,12
彼女 の 母 は ９ 時 １０ 分 の 列車 で 着 く 。,14
父 は 頭 が はげ て き て い る 。,11
今 もし 私 が 金持ち だっ た ら 、 海外 へ 行 く だ ろ う に 。,18
万一 彼女 が 遅れ て き た ら 、 この メッセージ を 伝言 し て 下さ い 。,18
彼女 は 目 を 輝 か せ て 入 っ て 来 た 。,14
うち の 車 に は エアコン が 付 い て い る 。,13
我々 は 最近 の 研究 に 遅れ を と っ て い る 。,14
私 の 最も 悪 い 習慣 は タバコ を 吸 う こと で す 。,15
天気 が 許 せ ば 、 私 は 行 き ま す 。,13
あ の 女性 の 男癖 の 悪 さ に は あきれ て 物 が 言え な い 。,18
パターソン 博士 ： まさか 。 彼女 は その 子猫 に 大変 優し く し ま し た 。,18
君 の アイディア は 新し い と は 言え な い 。 私 は 去年 、 それ を 別 の 筋 から 聞 い た 。,26
昨晩 、 私 たち は 高校 時代 の こと を 楽し く 語り合 っ た 。,16
彼女 は その 結果 を み て 喜 ん だ 。,11
毎朝 、 雌牛 は 仔牛 に 乳 を や る 。,11
彼 は ５ つ の 殺人 を 犯 し た 。,11
宝塚 で ショー を 見物 し ま し た か 。,11
コーヒー を お 飲 み に な り ま せ ん か 。,13
家 の 前 に 多数 の 車 が 駐車 し て い る 。,14
党 が 連合 し て 、 新し い 政府 と な っ た 。,14
学生 は 読書 の 技能 を 磨 く べ き だ 。,12
私 は 駅 で 一 時間 彼 を 待 っ た が 、 彼 は や っ て 来 な かっ た 。,23
どっこい 。 そう は い か な い よ 。,10
私 は ショー の 劇 が 特に 好き と い う わけ で は な い 。,17
私 は 彼女 の ため に 数 回 その 言葉 を 繰り返 し た 。,15
この 仕事 に は 憂鬱 に な る 。,9
良書 は 最良 の 友 で あ り 、 今日 も 今後 も 永久 に 同じ で あ る 。,20
期末 試験 の 結果 は 決して 満足 の い く もの で は な かっ た 。,17
あの 会社 は 、 人種 や 宗教 、 国籍 に 関係 な く 人 を 雇 う 。,18
ぼく と 映画 に 行 き ま せ ん か 。,11
テレビ は 日常 生活 で 重要 な 役割 を 果た し て い る 。,15
行 き た く な く て も 行 か な く て は な り ま せ ん 。,20
古代 に お い て 塩 は 希少 で 貴重 な 商品 で あ っ た 。,17
あの 人 は 私 たち の 社長 だ から 、 それ 相応 に 敬意 を 払 わ な けれ ば な ら な い 。,25
あなた は 今日 、 何 を し た い で す か 。,13
彼 ら は 息子 に 絶望 し た 。,9
早寝 早起き は 健康 の 基本 だ 。,8
彼 が 笑 う と 、 子供 達 に は 彼 の 長 い 灰色 の 歯 が 見え ま し た 。,23
彼 は ５ 時 ちょっと 前 に 家 に つ い た 。,13
私 は 息子 に 夕食 を 作 っ て もら っ た 。,13
たいがい の 場合 、 彼 の 解答 は 正確 だ 。,11
遅 く とも 出発 の １ 時間 前 まで に チェック イン し て くださ い 。,17
誰 か お 宅 へ 車 で 迎え に 行 く よう 手配 し て お き ま しょ う か 。,22
彼女 は うれし さ の あまり 我 を 忘れ ま し た 。,13
夜明け に な っ て 初めて 彼 は 寝つ い た 。,12
もはや 彼 の 言 う こと を 信 じ な い 。,12
その 授業 中 は 日本 語 を 話 し て は いけ ま せ ん 。,16
トム と 僕 は 友達 だ 。,7
「 はい 、 会 っ た こと が あ り ま す 」 と ジョーダン さん は 言 っ た 。,21
どうぞ 遠慮 な く クッキー を 召し上が っ て くださ い 。,12
彼 は 早起き し よう と し た 。,9
テーブル に ひじ を 突 く の は やめ なさ い 。,12
私 は １ 日 中 仕事 を し て 疲れ き っ て い る 。,16
運転 し て い る 人 に 話しかけ て は な ら な い 。,15
彼 ら は 全て の 面 で 彼 を 支援 し た 。,13
彼 は 働 く 必要 は な い 。,9
彼 は 日本 の 内部 の 事情 を よく 知 っ て い る 。,15
私 は 東京 に 行 き た い 。,9
その 若者 は 途方 に 暮れ た 。,8
私 は その よう に 考え た 。,8
雨 が 降 っ た ら 、 練習 試合 は 延期 に する つもり だ 。,16
別 の セーター を 買 っ た の で 現在 ２１ に な り ま し た 。,18
その 法案 に は 反対 の 議論 が 多 かっ た 。,12
彼 は 半分 行 っ た 所 で レース から 脱落 し て しま っ た 。,17
市場 は 全面 安 で す ね 。,8
私 たち は 交通 渋滞 を 避け る ため に 裏道 を 通 っ た 。,16
ついに 、 インディアン の 二人 の 酋長 は 和睦 する こと に 決め た 。,15
い な い 者 が いつ も 悪者 に な る 。,12
２ 日 で ３ つ の 州 を 走破 し た 。,12
私 は 彼 から その 事故 の 話 を 聞 い た 。,13
ほとんど の 人 に は 前衛 的 すぎ る って 聞 い た わ 。,15
今朝 の 気温 は 零下 １０ 度 で あ っ た 。,12
その 犬 が 好き で す 。,7
彼 は 親切 に も 私 たち に お 金 を 貸 し て くれ ま し た 。,19
それ は 一種 の 冗談 に すぎ な い 。,10
母 は 自転 車 に 乗れ ま せ ん 。,10
誰 が 一番 先 に 来る と 思 い ま す か 。,13
