その 本 が 欲し い 人 は 誰 に で も あげ て よ い 。,16
ラジオ の 音 を 小さ く し て いただけ ま せ ん か 。,14
彼女 は ぼく の 注意 を ひ い た 。,10
「 なぜ 行 か な い の 」 「 行 き た く な い から さ 」,18
彼 が 言 っ た こと など 気 に 留め る な 。,13
直 し て あ る 古 い 汽車 に 乗 る こと も 出来 ま す 。,17
泣 か な い で は い られ な い 。,11
ここ で 迷 わ ず 迂回路 を 取 る こと に する 。,13
ご 無 沙汰 し て い ま す 。,9
その 後 彼女 が どう な っ た か 、 さっぱり 分か ら な い 。,16
合衆 国 に は 何 種類 も の 気候 が あ る 。,13
ドア は 押 さ れ て 開 い た 。,10
私 の 部屋 に は あまり 家具 が あ り ま せ ん 。,14
会社 は 何 と か 倒産 せ ず に す ん だ 。,13
成功 は あなた 自身 の 努力 しだい で あ る 。,11
二人 とも 今 は 舞い上が っ て い る けど 、 会 う は 別れ の 始め 、 って こと 知 っ て い る の か ね 。,29
箱 の 中 に 沢山 の 道具 が あ る 。,11
次 の 停留 所 で お 降り下さ い 。,9
重力 が 物 を 地球 の 中心 に 引っ張 っ て い る 。,14
お 父 さん が 宿題 を 手伝 っ て くれ た 。,12
ウィルス は 人類 が 存在 する 限り 存在 する で あ ろ う 。,14
政治 的 意識 を 持 つ よう に な る に は 時間 が かか る 。,17
私 が 何 と か し て 欲し い と あなた に お 願い する の は これ が 最後 で す 。,23
自分 の 職場 に 、 見 る から に とても 気 が 強 い 女性 が い ま す 。,20
私 は 時代 に 遅れ な い よう に する ため 本 や 雑誌 を 読 む 。,18
これ ら の ティー カップ は 対 に な っ て い る 。,14
彼女 は 頭 が 良 く て 、 最も い い と子 は 大変心 が 優し い 。,18
どう し て 、 もっと 早 く 言 っ て くれ な かっ た の で す か 。 そう すれ ば 対処 でき た の に 。,28
水たまり に 足 を 突っ込 ん だ の で 、 靴 が グチョグチョ に な っ た 。,18
概し て フロリダ の 気候 は 穏やか だ 。,9
彼 は 仲間 に 歩調 に 合わせ た 。,9
ケン は 野球 部 に 入 っ た 。,9
ライオンズ は ホークス に 楽勝 し た 。,8
私 の 部屋 に は 電話 が あ る 。,10
ジュディ は とても 利口 な 学生 で あ る 。,10
あんな ふう に 話 す と は 彼 は ばか に 違い な い 。,15
彼女 は 仕事 が 終わ っ た とき ほっと ため息 を つ い た 。,15
バケツ に 水 を １ 杯 く ん で 持 っ て 来 なさ い 。,16
あなた は あの 車 を どう 処理 し た の で す か ？,14
君 が 成功 し て うれし く 思 い ま す 。,12
彼 は 目 を 閉じ て 音楽 に 耳 を 傾け た 。,13
とおり に は 人 一 人見え な かっ た 。,10
その 店 は 若 い 人 たち で 混 ん で い た 。,14
日本 は 非常 に 地震 の 害 を 受け やす い 。,12
彼 は ３ 人 の うち で 一番 利口 で は な い 。,14
その 弁護 士 は 大変 な やり手 な の で 依頼 人 が 多 い 。,16
その 本 は どれ も ため に な ら な い 。,12
実 は ね 、 この 地域 で 一番 の 美女 と 結婚 する 事 に な っ た ん だ ？,21
登場 する 人物 、 団体 および 地名 は 実在 する もの と 一切 関係 あ り ま せ ん 。,20
彼 は テニス を する の が 好き だ 。,10
彼 は ２ 度 と 彼女 に 会え な い よう 運命 づけ られ て い た 。,18
来 なさ い と 言 わ な い 限り 来 な い よう に 。,15
ビル は 銃 で 殺 さ れ た 。,9
あなた は 私 たち の 英語 の 授業 を 見 た い で す か 。,16
その 列車 は ロンドン 行き だ 。,7
その 県 知事 は ７ 月 の 選挙 で 勝利 を おさめ ま し た 。,16
ぼく は かれ を そう 考え て は い な い の で す 。,15
君 は その 案 を 実行 する の に 少し 苦労 する だ ろ う 。,16
彼女 は 結婚 し た の かしら 。,8
キリスト は 多く の 奇跡 を 行 っ た と 信 じ られ て い る 。,17
あなた 自身 の 感覚 を 持 つ こと が 大切 だ 。,12
正装 し な けれ ば 。,6
この 犬 は ２ ヶ月 前 に 生まれ ま し た 。,12
わたし 達 は その 詩 を 暗記 し た 。,10
疲れ て い て これ 以上 は 歩け ま せ ん 。,12
もう お 済み で す か 。,7
どう し て その よう に 考え られ る の で す か 。,14
だれ し も 、 楽し い 青春 を 平穏 無事 な 時期 と し て 想い起こ す 。,18
私 が 学校 に 着 い た とき ベル は すでに 鳴 っ て い た 。,17
この ホテル で あなた に 会 う と は おどろ い た 。,13
彼 は その 乗馬 クラブ へ 入会 を 申しこ ん だ 。,12
京都 は たくさん の 観光 客 が 訪れ る 。,10
英語 で 話 す の は 楽し い 。,9
どう ？ 来 な い ？,6
彼 は 自分 の 行為 の 結果 が どう な る か を 計算 し た 。,17
私 は その お 金 を 全部 盗 ま れ て しま っ て 困 っ た 。,18
彼 の 沈黙 は 事実 上 罪 を 認め た こと だ 。,13
彼女 は よ い 知らせ を 持 っ て き た 。,12
パーティー の すす み 具合 は どう で し た か 。,12
メアリー は 川 を 泳 い で 渡 る 事 が でき ま し た 。,16
私 は 彼女 を 高 く 評価 し た 。,10
私 は 彼 を 見送 る ため に 空港 に 行 っ た 。,14
私 たち は 君 に 一 つ 忠告 し た い 。,12
彼 は 気難し かっ た 。,6
彼 等 は その 日暮らし の 生活 を し て い る 。,13
明日 何 が 起こ る か なん て だれ も わか ら な い 。,15
その 会社 は 西 海岸 に あ り ま す 。,11
母 は 大丈夫 だ と 言 っ た 。,9
料理 が 得意 で す か 。,7
犬 は すべて 忠実 だ 。,6
どの イヌ も 生き て い ま す 。,9
彼 は 天気 の よ い 日 を 利用 し て 壁 を 塗 っ た 。,17
両親 に 知れ たら 面倒 な こと に な る よ 。,12
彼 は バス か 電車 で 学校 に 来る 。,10
トム は クラス が 会 を する べ き だ と の 動議 を 出 し た 。,18
何 で も わがまま を 通せ る と 思 っ て は いけ な い 。,16
完全 に 死 ん だ 人 に は 仲間 は い な い 。,14
これ は 何 を 表 し ま す か 。,10
彼 等 は いわゆる 戦争 の 犠牲 者 だ 。,10
エレン は 英語 を 話 し ま せ ん 。,10
彼 は 腹 を 立て た 。,7
ケーキ もう １ つ いかが 。,6
この クイズ は 全然 分か ら な い 。,9
あまり 期待 さ れ て も こま り ま す 。,11
今週 は ずっと 働 い て い た 。,9
毎年 、 世界 各地 に 異常 な 天気 が 起き て い ま す 。,15
世界 で いちばん い い 仕事 だ もの ね 。,10
私 は 北海道 で 暮ら し た かっ た の だ が 。,13
彼 は そう 言 う 権利 が あ る と 主張 し て い る 。,16
タイヤ に 空気 を 入れ た 。,7
もう 大学 生 な ん だ から 、 君 は もっと 一生 懸命 勉強 す べ き だ 。,19
驚 い た こと に 、 彼女 は 一人 で ブラジル に い っ て しま っ た 。,19
遠く で 虎 が ほえ て い る の を 耳 に し た 。,15
彼 の こと を 笑 っ て は いけ な い 。,12
彼女 は 腰 を かがめ た 。,7
これ まで の ところ は 旨 く い っ て い る 。,13
ロス 出張 を キャンセル し よう か な 。,9
うち の 庭 は 雑草 だらけ だっ た 。,9
リズム は 軽快 で テンポ は 速 く 、 その 曲 は 若者 に 好 ま れ て い る 。,21
ジャパン ・ タイムズ に は その 話 は 載 っ て い な い 。,15
彼 は 病気 で 寝 て い る なんて かわいそう だ 。,12
休日 は 楽し かっ た ？,6
彼 に と っ て 成功 の 誇り を 隠 す の は 困難 だっ た 。,17
舞台 で 歌 っ て い る 少女 は 誰 な ん で す か 。,16
彼 は 以前 は タバコ を 吸 っ て い た が 、 今 は 吸 わ な い 。,20
ガラス は 壊れ やす い 。,6
あなた は そう する こと で ずっと 手間 が 省 け る だ ろ う 。,16
京都 に 着 い たら 必ず 私 たち に 電話 を し て くださ い 。,16
若 い ころ 彼 は ホテル を 経営 し て い た 。,13
彼女 は 英語 は 言 う に 及 ば ず 、 ドイツ 語 と フランス 語 も 話 し ま す 。,22
少し 、 出しゃば り すぎ る と 思 わ な い か 。,13
坂崎 幸之助 は アルフィー に 所属 し て い ま す 。,12
それ は 侵略 から 街 を 守 る ため に 造 ら れ た 要塞 だ 。,17
私 は 毎日 顔 を 洗 い ま す 。,10
ジェシー は コーヒー を 入れ る 為 に お 湯 を 沸か し て い る 。,17
乗組 員 たち は 宇宙 へ の 航海 の 準備 に 忙し い 。,14
はい 。 １００ メートル を １２ 秒 で 走 る 事 が でき ま す 。,16
注意 し て ！ 道路 に 穴 が あ い て る よ 。,14
本気 で 似合 う と 思 っ て い た らし い シャツ は 辞退 し 、 淡 い ブルー の ポロ シャツ を いただ く こと に し た 。,31
暑 い 日 に 水 は 早 く 蒸発 する 。,11
彼女 の 母親 は 夕食 を 作 る の に 忙し かっ た 。,14
印刷 の 誤り が たくさん 見つか っ た 。,9
彼 は 君 の 成功 を ねた ん で い る 。,12
私 達 は テレビ で 野球 の 試合 を 見 た 。,12
すべて の 差別 を 無く す ため に 、 私 たち は あらゆる 努力 を し な けれ ば な ら な い 。,24
ジョーンズ さん は 、 奥 さん が 英語 を 教え て い ま す が 、 ご 自身 も 大学 の 英語 の 先生 で す 。,27
その 仕事 を 心配 する な 。,7
トヨタ は 今年 従業 員 を １０００ 人 削減 する こと を 発表 し た 。,16
私 たち は 公明 正大 に 行動 する 。,9
私 は ベル を 鳴ら し て 待 っ た 。,11
小鳥 たち が 森 の 中 で さえず っ て い た 。,13
二 日 後 に 彼 は 帰 っ て き た 。,12
彼女 が 助け て くれ る の を いつ も 当て に 出来 る 。,15
彼 は 京都 大学 で 学 ん で お り ま す 。,13
彼 は よ い 生徒 で す 。,8
５ 年間 アメリカ に 住 ん で い た から だ よ 。,13
その よう な 振る舞い は どんな 事 が あ っ て も 許 さ れ な い 。,18
彼 に いつ 会 い ま し た か 。,10
なん と 素晴らし い 発明 だ ろ う 。,9
彼女 その 瞬間 に カッ と な っ た ん だ ね 。,13
君 は この 事 が 分か る 年齢 だ ね 。,11
私 たち は 子供 の 頃 持 っ て い た ある 種 の 感覚 を 決して 失 わ な い 。,22
あなた が それ を 考え直 し て 止め て もらえ れ ば と 思 い ま す 。,18
パトロール カー は その 地区 の 全体 を 警備 する 。,11
彼 は 自分 の 仕事 に 満足 し て い る 。,12
私 は それ を 新聞 で 読 ん だ 。,10
日本 の 家 の 中 で は 靴 を ぬ ぎ なさ い 。,14
何 と い う エネルギー の 浪費 だ 。,9
彼女 は 外出 し よう と し て い た 。,11
彼女 は 漫画 本 に 夢中 に な っ て い た 。,13
彼 は 生活 が みじめ な ん で す よ 。,11
会議 の あと ジョン と 話し合 っ た 。,9
彼 に 金 を 貸 し た ら ダメ だ って こと を 分か っ て い よ う もの を 。,22
その 詩人 と 小説 家 は ２人 とも 会議 に 出席 し て い た 。,16
免許 証 を 見せ て いただけ ま す か 。,10
彼 は 成長 し て 立派 な 紳士 に な っ た 。,13
大 部分 の 客 は 外国 人 だっ た 。,10
彼 の 失敗 は 性格 と 関係 が あ り そう だ 。,13
だれ し も 自分 の し た こと に は 責任 が あ る 。,15
彼 に 私 の 時計 を 修理 し て もら っ た 。,13
彼女 は 金儲け の こと しか 考え な い 。,10
雨 が 降 る と いけ な い から 、 傘 を 持 っ て 行 き なさ い 。,20
東北 ・ 秋田 新 幹線 が 運転 を 見合わせ る など 交通 も 混乱 し た 。,17
彼 は 来月 叔母 さん と おじ さん を 訪ね る つもり で す 。,15
勝 とう が 負け よう が 、 正々 堂々 と 戦 わ ね ば な ら ぬ 。,18
彼女 は 稼 ぐ の と おなじ だけ の お 金 を 使 う 。,15
彼 が 自分 で 手紙 を 書 く はず が な い 。,13
彼 は 私 の 叔父 で す 。,8
台風 は 計 り きれ な い ほど の 損害 を もたら し た 。,15
その 男 は 私 の 足 を 踏 ん だ の に わび る こと さえ し な かっ た 。,21
彼 は 奥 さん が お 姑 さん と うま く や っ て いけ る か が 心配 だ 。,21
あなた は バス で 通学 する の で す か 、 それ と も 電車 で で す か 。,20
彼 は 年 を 取 る に 連れ て いっそう 頑固 に な っ た 。,16
悪 い 人間 が 国家 の 要職 に 就 い て い ま す ね 。,16
彼 ら は その 計画 に 賛成 だ 。,9
彼 は わざと 私 を 蹴 っ た 。,9
相手 チーム は ライン を 越え させ ま い と し た の で す 。,16
今夜 劇場 に いく つもり で す か 。,9
彼女 に は どこ と な く 品 が あ る 。,12
予算 は かろうじて 議会 の 承認 を 得 た 。,10
会議 に 時間 どおり に 現れ た の は ２、３ 人 しか い な かっ た 。,17
旨 く 行 わ れ れ ば 何 回 実験 を 繰り返 し て も 、 最初 の 実験 の 質 が 十分 保証 さ れ る の だっ た 。,31
次 の 章 を よく 予習 し て お き なさ い 。,13
やめ ろ よ 。 あいつ は 俺 たち の 友達 だ ろ 。,13
試験 中 、 彼女 は 気分 が 悪 く な っ た の で お 手洗い に た た せ て もら っ た 。,25
彼 ら の 努力 は 実 を 結 ば な かっ た 。,13
その 問題 を うやむや に し て お く こと は でき な い 。,15
委員 は 全員 その 計画 に 賛成 で あ る 。,11
願い が 現実 に な る と よ い の だ が 。,13
おまえ なんか 見 る の も 嫌 だ 。,9
ストレス の 一般 的 な 原因 は 、 仕事 と 人間 関係 で あ る 。,16
その 部屋 は 小さ い の で 、 中 で は 遊べ な い 。,15
何 か 良 い 計画 を 思い付き ま し た か 。,12
この 季節 は 食物 が くさ り やす い 。,10
彼 は 時間 に 正確 な こと が 自慢 だっ た 。,12
彼 は フランス 語 だけ で な く スペイン 語 も 話 す 。,14
誰 が ホーム ラン を 打 っ た の で す か 。,13
あなた は その 計画 に 参加 し ま す か 。,11
あなた だけ が 私 の 希望 で す 。,9
私 たち は そこ で その 夏中 楽し い 日々 を おく っ た 。,15
私 は 今日 自分 の 申込 書 を 上司 に 提出 する つもり だっ た が 、 彼 に 先 を 越 さ れ て しま っ た 。,29
その 学者 は ライフワーク を 続け た 。,8
この 齧歯 動物 は 冬 に 木の実 を 貯え る 。,11
彼 は 私 に 頼み ごと を し た 。,10
人工 栄養 で 育て て い ま す 。,9
私 は 飼い犬 に 手 を か ま れ た 。,11
彼 は 缶詰 を あけ て い る うち に 指 を 切 っ た 。,16
学生 生活 を なまけ 過ご す と は 愚か な こと だ 。,13
私 は あなた の い な い 人生 なんて 想像 も でき な い 。,15
教訓 より も 実行 が 大切 。,7
私 の 母 は ケーキ の 作 り 方 を 知 っ て い る 。,16
ロンドン の 人口 より 東京 の 人口 の 方 が 多 い 。,13
もし 困 っ た 事 が あ れ ば ユーザーズ ガイド に あた っ て くださ い 。,18
愛犬 の 病気 は 重 かっ た 。,8
で す から 信じ る こと で す 。,9
ダブル ルーム を 予約 し て い ま す 。,10
私 たち は 横浜 から 神戸 まで 航行 し た 。,11
急 を 要 する こと だ から 急 い で くださ い 。,13
彼 は 腕 を ３ 度 撃 た れ た 。,11
牛 は 角 に よ り 、 人 は 言葉 に よ り 捕まえ られ る 。,17
君 の ネクタイ は 背広 に よく 調和 し て い る 。,13
彼 は 崇拝 の 眼 で 彼女 を 眺め た 。,11
その 赤ん坊 が 燃え て い る 家 から 運び出 さ れ る の を 見 た 。,18
雌熊 は 私 たち を 襲 う 。 そして 幸福 を みつけ る 代わり に 、 命 を 落と し て すべて が 無駄 に な っ て しま う 。,31
風邪 を 引 く と 、 風邪 が なかなか 抜け ま せ ん よ 。,15
スミス 氏 は 立派 な 先生 で あ る 。,10
僕 たち の 先生 って 本当 に 頭 が 固 い よ ね 。,14
彼女 は 、 彼 を 、 死 ぬ ほど 驚 か せ た 。,14
彼 は 今 どこ に 居 る の か 知 ら な い 。,14
二 度 と あなた の 誤り を 許 し ま せ ぬ 。,13
息子 さん の お 仕事 は 何 で す か 。,11
私 たち は 一 日 に 三 度 食事 を する 。,12
ライン 川 は フランス と ドイツ の 境界 線 で あ る 。,13
この バラ は 実 に 甘 い 香り が する 。,11
マーテイン ・ ルーサー ・ キング ・ ジュニア は 、 平和 的 に 抗議 の 意志 を 表明 する よう に 、 黒人 市民 を 説得 し た 。,28
寝 不足 だ と 注意 が 散漫 に な り がち で す 。,14
今週 の 週末 に は 何 か 約束 が あ り ま す か 。,15
彼 は お 茶 を 一杯 飲 ん で から 、 お 代わり を 頼 ん だ 。,18
君 は 人前 で 話 を する こと に は すぐ 慣れ る だ ろ う 。,17
その 本 の 値段 は ５ ドル で し た 。,11
ジョン は ぶどう 酒 を 何 本 も 飲 ん だ 。,12
急 が な い と 学校 に 遅れ ま す よ 。,12
ジム は ボーイ の 仕事 に ありつ い た 。,10
禁煙 する つもり だ 。,5
この ショー で は ロボット に 重点 が お か れ て い る 。,15
我が 国 は 近隣 諸国 と の 貿易 を 促進 せ ね ば な ら な い 。,18
彼 の 演説 に は 少し 皮肉 っぽ い ところ が あ っ た 。,15
丸 く おさま っ て よ かっ た 。,9
成長 期 で 、 元気 の な い 子供 は 医者 に 手当 し て もら う 必要 が あ ろ う 。,23
次 は いつ 集ま る こと に し よう か 。,11
尿量 が すくな い で す 。,7
嵐 は 多く の 被害 を もたら し た 。,10
彼女 は 魚 と ゴキブリ に だけ 興味 が あ る 。,12
君 は もっと 熱心 に 勉強 し な けれ ば な ら な い 。,15
同社 は 東証 に 上場 し て い る 。,10
東京 へ いらっしゃ っ た とき は 連絡 し て くださ い 。,13
電話 番号 を 間違え た よう だ 。,8
彼 ら は 施し を 受け て 暮ら し て い る 。,13
何 て 答え た の ？,6
仕事 が だんだん 困難 に な っ て き た 。,11
私 は 由美 は 病気 だ と 思 う 。,10
これ は 私 の 好み に ぴったり で す 。,10
彼女 は 裁縫 が 上手 で す 。,8
ご 要望 に 添え る よう でき る だけ の こと を し ま しょ う 。,17
私 と 結婚 し て くれ ま せ ん か 。,11
私 は 指定 の 日 まで に 仕事 を 片づけ な けれ ば な ら な い 。,18
蝙蝠 は とり で は な い 。 それ が 魚 で そう で な い の と 同じ だ 。,21
彼 は 付き合 っ て い て 面白 く な い 。,12
本 を 読 む の は 、 私 の 習慣 で あ る 。,14
イギリス で は トラック は ローリー と 呼 ば れ る 。,12
君 は 彼女 と 比べ て 勤勉 だ 。,9
私 は 聞き 耳 を 立て た 。,8
しかし 私 は 恐れ な かっ た 。,8
彼 は 自分 の 年齢 を 考慮 に 入れ る べ き だっ た 。,15
枕 を 下さ い 。,5
彼 ら は 事故 の 現場 へ 急行 し た 。,11
彼 は 病気 を こじらせ て しま っ た 。,10
ぼく の 家 は 目障り だっ た けれど 、 小さな 目障り だっ た から 、 見逃 さ れ て い た 。,22
彼 は １０ 冊 も 辞書 を 持 っ て い る 。,13
私 は 仕事 を 一 つ 終え る ごと に リスト の 上 で チェック する 。,17
彼 は 昼食 後 また 読書 を 始め た 。,10
あの 娘 は なに を 着 て も かわい い 。,11
１ 時間 し た ら 電話 し ま す 。,10
約束 や ぶ っ た ら 、 絶交 で す から ね ？,13
彼 は その 犬 に 石 を 投げ た 。,10
彼 の 借金 は 合計 １０００ ドル 以上 に な る 。,12
私 達 は 彼女 を 置 い て い か な けれ ば な ら な い か も しれ な い 。,23
彼 は 私 の 気持ち に 気づ い て い る よう だ 。,14
その 車 は スリップ し て も ある 程度 は コントロール でき ま す 。,15
この 門 から 庭園 に 入れ る 。,8
その ２ つ の バージョン の 違い は はっきり し て い な い 。,15
いつ も 夕食 の 後 何 を し ま す ？,11
昨夜 は 楽し かっ た 。,6
状況 は 相 変わ ら ず その まま だ 。,10
２人 は ２ 月 ５ 日 に 婚姻 届 を 出 し た 。,14
すぐ 出発 すれ ば 汽車 に 間に合 う だ ろ う 。,12
私 は 一 時期 、 天体 物理 学 者 に な り た かっ た 。,16
私 達 は 砂糖 を 使 い き っ て しま っ た 。,14
君 は ああ い っ た 男 たち と 交際 し な い ほう が い い 。,18
雨 で 遠足 は 延期 し な けれ ば な ら な く な っ た 。,17
もう 家 へ 帰 っ て も い い で す か 。,13
それ は 私 に と っ て い い 知らせ だ 。,12
私 は スーパーマーケット へ 行 っ て き た ところ で す 。,13
私 は 、 次 の 夏休み に そこ へ 連れ て 行 っ て くれ る よう に 、 祖父 に 頼 む つもり で す 。,27
君 の 幸運 が うらやまし い 。,7
そんな 奇妙 な こと って あ る もの か あり は し な い 。,15
メアリー が 彼 を 見 た とき 、 驚き の 表情 が 彼女 の 顔 に 浮か ん だ 。,20
私 達 は ニュートン が 引力 の 法則 を 発見 し た と 教え られ た 。,17
前 の 会社 で は 何 で も 屋 に 終始 し た の で 今度 は 専門 職 に 就 き た い 。,25
アメリカ で は 毎年 多数 の フリー エージェント が チーム を 移 る 。,14
万事 上手 く い っ て ま す 。,9
彼 は この 本 に 千 円 払 っ た 。,11
どうぞ 、 私 の レポート の コピー を ７０ 部 お 作 り くださ い 。,16
彼 ら は 海水 から 塩 を 取 る 計画 を 立て た 。,14
彼 は 持 っ て い る 無け 無し の お 金 を 私 に くれ た 。,18
私 は 叔母 あて に 手紙 を 出 し ま し た 。,13
私 は 彼女 に は まったく 満足 し て い な い 。,13
君 も 彼 の よう に この 本 に 興味 が あ る の か 。,16
医者 に は 行 っ た の ？,8
それ は よく 分か り ま せ ん 、 場合 に よ る で しょ う ね 。,18
７ 月 の 天候 は だいたい 暑 い 。,9
私 は 彼 に 垣根 の ペンキ を 塗 ら せ た 。,13
トム 、 君 に もう 一 度 会え る なんて 最高 だ よ 。,14
彼女 は 金融 市場 の 取材 を 担当 し て い る 。,13
私 の 叔母 は 莫大 な 財産 を 相続 し た 。,12
その 条件 に は 全く 不 満足 で す 。,10
彼 の 冷酷 な 言葉 が 今 で も 私 の 心 の 中 で うず い て い る 。,21
すばらし い 考え が ジョン に 浮か ん だ 。,10
私 の 叔父 は 釣り が 大好き で す 。,10
地震 の 起こ る 危険 は ほとんど な い 。,10
この 前 手紙 を 書 い た 時 以来 別 に 新し い 事 は 何 も 起こ っ て い な い 。,24
私 達 は 彼 の 名前 を よく 知 っ て い る 。,14
彼 の ほう に は 異議 は な かっ た 。,11
中庭 の 席 が あ り ま す か 。,10
今日 で は １９５０ 年 の ３ 倍 以上 の 数 の 車 が 走 っ て い る 。,20
私 達 は みんな で ８ 人 で す 。,10
私 は あなた を 尊敬 し て い る 。,10
彼 ら は 捕 り立て の 魚 を 朝市 で 売 っ て くれ る 。,16
一般 的 に 言 っ て 日本 車 は 海外 で 人気 が 高 い 。,16
彼 は 怒り を 抑え よう と し た 。,10
私 に それ を もう 一 度 さ せ て くださ い 。,13
残念 で す が あなた の 請求 は 拒否 さ れ ま し た 。,15
彼 は ピクニック へ 行 か な い し 、 私 も 行 か な い 。,17
先生 は 私 に ぜひ 大学 で 勉強 する よう に と 強 く おっしゃ っ た 。,18
恭子 は 鼻歌 を 歌 い ながら 行 っ て しま っ た 。,14
航空 便 に する と 値段 は いくら かか り ま す か 。,14
彼 は 目 を 丸 く し て びっくり し た 。,12
