私 は 昨夜 車 を 盗 ま れ た 。,10
彼女 は 自分 の 傘 に 赤 い リボン で 目印 を 付け た 。,15
スタイン 先生 が すぐ に 診察 し ま す 。,10
運試し だ 、 や っ て ごらん 。,8
そんな こと を 考え ながら 『 我輩 は カモ で あ る 』 を 再見 し ま し た 。,20
テレビ で 野球 の 試合 を 見 た い で す か 。,13
私 の 兄 の 未亡人 は 再婚 し た 。,10
タクシー を 呼 ん で あげ ま しょ う 。,10
ふふ 、 恵一 君 いつ も 授業 終わ っ た ら 、 ノビ する よ ね 。,17
彼 の 出身 は アイルランド で あ る 。,9
新し い 規約 は 全会 一致 で 承認 さ れ た 。,12
あなた が 汚し さえ し な けれ ば 、 私 の 持 っ て い る どんな 本 で も 貸 し て あげ ま す よ 。,28
あなた は 何 か ほか の こと を 考え て た よう で す ね 。,16
彼 ら は すべて が 前 も っ て 用意 さ れ て い る よう 要求 し た 。,20
彼女 は 生まれ ながら の 音楽 家 だ 。,9
ジョン は 子供 の 頃 から ずっと 切手 を 集め て い る 。,14
今日 も 暑 く な り そう だ 。,9
この 帽子 は あなた の もの で す か 。,10
私 たち は 日本 の 歌 を いく つ か 習 い た い 。,15
彼女 は 熊 を 見かけ て 身 が す く ん だ 。,13
金儲け の こと を 除 け ば 、 私 は 不 動産 の こと に は 興味 は な い 。,21
彼女 の 声 は よく 通 る 。,8
テキサス 州 は メキシコ と 接 し て い る 。,11
僕 を 何 だ と 思 っ て い る の か 。,13
その 医者 は 事故 で 負傷 し た ４ 人 を 救 っ た 。,15
ここ で は タバコ を 吸 っ て は いけ な い 。,13
先生 の おっしゃ る こと を もっと 注意 し て 聞 く べ き だ 。,16
私 は 旅行 の ため の 費用 が 不足 し て い る 。,14
彼 は どの よう に し て その 大 問題 を 解決 し た の か 。,17
彼 は 嫌 な 思い出 が 消え る こと を 願 っ て い る 。,16
彼 ら は 牛 や 馬 を 飼 っ て い る 。,13
息子 は な い もの ねだり を し て い る 。,12
彼女 が 来る 必要 は な かっ た 。,9
私 は 彼女 の ドレス の シンプル な ところ が 好き だ 。,13
彼女 は 危険 だ と 思 い も し な かっ た 。,13
次郎 は 富士 山 を スケッチ し た 。,9
あなた に また 会え て とても うれし かっ た で す 。,12
その 事実 は だれ に も 知 ら れ て い る 。,13
共同 事業 の 始め 方 に つ い て 彼 ら は 互い に 話し合い が つ い た 。,20
それ は どの くらい 前 の こと で し た か 。,12
彼 は クラブ の 講演 を 免 じ て もら っ た 。,13
彼 は 少し 休 み ま しょ う と 提案 し た 。,13
君 たち 、 騒 が な い で 。,9
囚人 たち は 鎖 に つな が れ て い る 。,12
マネージャー は 彼 の 功績 を 称え た 。,9
あなた は この 時計 を 直 し て もら い た い の で す か 。,17
部屋 に は 新聞 が いっぱい 散らか っ て い る 。,12
第 四 に 、 小熊 を 連れ去 る こと に 成功 し て も 、 私 たち は 休憩 を せ ず に 山 を 駆け上が る こと が でき る だ ろ う か 。,36
君 は ずぶぬれ だ 。,5
この りんご は すっぱ い 味 が する 。,9
彼女 は 一生 懸命 手紙 を 書 い た 。,10
土地 の 人々 を 扇動 する ため に スパイ を 送り込 ん だ 。,14
何事 も 諦め が 肝心 だ 。,7
穴 が あ れ ば 入 り た い 気持ち だ 。,12
この 鞄 は 車 で 運 ば れ ま し た 。,12
私 たち は あ る 事故 の ため に ２ 時間 遅れ た 。,14
僕 が 彼 より 雑誌 を 多 く 売 る こと に 彼 と １ ドル 賭け た 。,19
彼 は 決して 習慣 を 破 ら な い 。,10
私 は 留学 する こと を 決め た 。,9
次号 で は 離婚 に つ い て 特集 し ま す 。,13
この 電話 は 故障 中 。,6
午前 中 彼 に 電話 を し て はな し ま し た 。,14
日曜 日 まで 滞在 を 延ば し た い の で す が 。,14
司祭 は 彼 ら を 夫婦 で あ る こと と 宣言 し た 。,15
音楽 会 に 遅れ て き た 人 が 多 かっ た 。,13
トム に 訊 い て き ま す ね 。,10
きょう の 英語 の 授業 に は 欠席 し ま す 。,12
私 たち の 計画 は 天気 次第 で あ る こと は 言 う まで も な い 。,19
私 は 大学 で 経済 学 を 勉強 し て い ま す 。,14
私 は 彼 の 要求 を 断 っ た 。,10
お 辞儀 は どう し た の ？,8
君 の 部屋 は いつ で も きれい な 状態 に 保 た れ て い な けれ ば な ら な い 。,24
父 は 最近 タバコ を やめ ま し た 。,10
彼 は ああ や れ ば 良 かっ た の に 。,12
彼女 は 風邪 を 引 き やす かっ た 。,10
「 彼 は 成功 する だ ろ う か 」 「 どう も 怪し い 」,16
あなた が どんな 理由 を つけ よう と 、 私 は あなた の 言 う 事 を 信じ る 事 が 出来 ま せ ん 。,26
彼女 が そんな に 良 い 申し で を 断 っ た こと に 私 は 驚 い て い ま す 。,23
その 調子 で がんば っ て 。,7
その 列車 は ２ 時間 前 に 出発 し た 。,11
今朝 は 郵便 が たくさん き た 。,8
スチーム ショベル は 片方 に 三 階 建て 、 もう 片方 に 四 階 建て の 地下 を 掘 り ま し た 。,24
雨 が ますます ひど く 降 っ て い る 。,11
その 物語 の 初め は おもしろ かっ た 。,9
彼女 は 行 か な い こと に 決め た 。,11
ジョン は 私 の 親友 で す 。,8
ロンドン は 世界 最大 の 都市 の ひと つ で あ る 。,13
牧野 博士 は 多く の 人々 に 尊敬 さ れ て い る 。,14
結婚 式 は 天候 に かかわ ら ず 催 さ れ る だ ろ う 。,16
誰 も なぜ だ か 分か ら な い 。,10
与党 は 野党 非難 の キャンペーン を 展開 し て い ま す 。,14
多く の 技術 を 修得 すれ ば する ほど 、 社会 に 対 し て 大きな 貢献 を する こと が でき る 。,24
私 は 彼 の 家 を 訪ね た が 彼 は 不在 だっ た 。,15
その 建物 は ７ 階 建て だ 。,8
その 話 に 我々 は 深 く 心 を 動か さ れ た 。,14
私 は １ 週間 で 目的 地 に つ い た 。,12
これ ら の 窓 は 彼 に よ っ て 開け られ る 。,14
キーン コーン ・ ・ ・ カーン コーン ・ ・ ・ 「 うわ 、 まず い 。 本鈴 だ ！ 」,20
我々 は みんな の ため に 戦 っ た 。,10
彼女 は 怒 っ て い る 事 を 示 そ う と わざと その 皿 を 割 っ た 。,21
君 は 勤務 中 は タバコ を 吸 わ な い 方 が よ い 。,16
ある 人物 が 不変 の 性質 で 全人生 を 貫 く と い う こと は 小説 の 中 だけ の 話 だ 。,24
彼 は すべて 知 っ て い る らし い 。,11
とげ の な い バラ は な い 。,9
もう 部屋 を 掃除 し ま し た か 。,10
彼女 は 男 が 死 ん で い る の を 見つけ た 。,14
や っ て しま っ た こと は 元 に 戻 ら な い 。,15
我々 は 平和 を 獲得 する よう 努力 す べ き だ 。,13
私 は 大変 気分 が 悪 い 。 ゲロ を は き た い で す 。,17
彼女 の 母 と まったく 同じ ほど 美し い 。,10
彼女 は 貧し い 人 達 の 味方 で す 。,11
彼 は とても 傷つ き やす い 性格 で す 。,11
ロング スカート は 今 は や り だ 。,9
秘書 は 解雇 さ れ た 。,7
空 は 私 たち の 頭上 に あ る 。,10
彼女 は 暗闇 の 中 に 姿 を 消 し た 。,12
われわれ は 彼 が 無罪 で あ る と 考え て い る 。,14
あの 学校 で は 新し い 英語 教授 法 を 採用 し た 。,14
住宅 計画 は ダメ に な っ た 。,9
彼 は 全身 泥まみれ だっ た 。,7
彼女 に 忠告 し て も 無駄 だ 。,9
我々 は 軍事 力 を 強化 す べ き だ と 、 大統領 は 言 っ て い る 。,20
彼 は ベル が 鳴 っ て から 着 い た 。,12
私 の 暇 な とき に 、 それ を やれ る と 思 い ま す 。,17
目的 は 手段 を 正当 化 する だ ろ う か 。,12
彼 は 彼女 に 秘密 を 知 ら せ た 。,11
なん だ って ずら から ねえ ん だ ！,9
私 の 申し立て は 本当 だ と 彼 は 発表 し た 。,13
その とき ジョーンズ さん が 何 か い い だ し た 。,13
彼 に 本当 の こと を 言 う なんて 君 は 不 注意 だ よ 。,16
その 湖 へ は バス で ３０ 分 で 到着 でき る 。,13
どこ へ 行 け ば ヨーロッパ の 地図 が 手 に 入 り ま す か 。,17
私 は １ ヶ月 に １ 回 床屋 に 行 く 。,12
カウチ ポテト に は 、 私 は なり た く な い 。,13
「 彼女 の 魅力 は 言葉 で は 表現 でき な い 」 、 と その 芸術 家 は 叫 ん だ 。,23
私 は 彼 に ペン を あげ る つもり で す 。,12
その 川 は あまり きれい で は な かっ た 。,11
公私 を 混同 し て は いけ な い 。,10
私 は 取り立て て 騒ぎ立て られ る の は 好き で は な い 。,15
彼女 は いつ も 僕 の あら捜し を し て い る 。,13
さも な けれ ば 、 一 等 賞 は とれ な かっ た だ ろ う 。,17
これ は どんな 学生 で も 解け る よう な やさし い 問題 だ 。,15
ジャック は そこ へ よく ジョギング に 行 っ た もの だ 。,13
ジョージ 、 話 が あ る 。 おっか さん が い る だ ろ 。,15
２００ 語 以内 で その 文章 を 要約 し て くださ い 。,13
予報 は さらに 降雪 が あ る と 伝え て い た 。,13
彼女 は 今 し方 外 出 し ま し た 。,11
彼 ら は 山 で 道 に 迷 っ た 。,11
病気 だっ た の で 、 一 日 中 家 に い た 。,14
彼 は 経験 に 欠け る 。,7
実際 は 彼 は 彼女 を 愛 し て い る 。,12
ギャンブル に 金 を 使 う くらい なら 、 捨て た 方 が まし だ 。,16
君 は 朝 寝 坊 に 違い な い 。,10
女王 様 が 長生き さ れ ま す よう に 。,11
彼 の その 論文 は 環境 問題 を 扱 っ て い る 。,14
来週 の 月曜 と 火曜 は 連休 だ 。,9
フランス 語 や イタリア 語 や スペイン 語 の よう な 言葉 は ラテン 語 から でき て い ま す 。,22
われわれ は その 困難 に 打ち勝 つ こと が でき た 。,12
次 の 問題 に とりかか っ た 。,8
我々 は 自由 の 為 に 戦 う 。,9
ぼく は 手品 を 熱心 に 研究 し て い る 。,12
バーゲン セール を 利用 し て お 金 を 節約 し よう 。,13
万一 もし ５ 月 に 雪 が 降 れ ば 、 彼 ら は びっくり する だ ろ う 。,20
彼 を ほめ な い 人 など 誰 も い な かっ た 。,14
私 が 自分 の し た こと を どんな に 後悔 し た か だれ も 信 じまい 。,19
私 は かわい い 犬 を 飼 っ て い ま す 。,13
今晩 は おかげ で 楽し い 晩 で し た 。,11
彼 は 野球 選手 に な る で しょ う 。,11
本 サイト 内 の 記述 、 画像 、 写真 の 無断 転載 ・ 転用 を 禁止 し ま す 。,20
金 衡 １ ポンド は １２ オンス で あ る 。,11
ホール に は 聴衆 は あまり い な かっ た 。,11
人 に 自分 の 勧告 が 理由 の あ る もの で あ り 、 賢明 で あ る こと を 説得 する ため に は 、 理由 を 挙げ 、 知 ら れ た 例 や 大家 を 引用 し な けれ ば な ら な い 。,49
ジェーン は もっと 休憩 を と ら な い と 、 神経 衰弱 に な る か も しれ な い 。,22
ケア プラン の 作成 等 の 居宅 介護 支援 事業 に つ い て は 、 介護 保険 に よ り 負担 さ れ ま す 。,27
ナンシー は 今 、 宿題 を し な けれ ば な ら な い の で す か 。,19
彼 は その 病院 に 多額 の 寄付 を し た 。,12
外 に 出 ろ 。,5
彼女 は 私 に アルバム を 買 っ て くれ た 。,12
彼 は 事故 の ため 仕事 が でき な く な っ た 。,14
この ところ 物価 が 安定 し て い る 。,10
水道 料金 を 滞納 する と 給水 を 停止 さ れ る と い う こと を お 聞 き し ま し た が 本当 で す か ？,30
この 言葉 は 、 大きな 天体 の 周辺 を 回転 し て い る 小さな 天体 全て に つ い て 使 わ れ る よう に な っ た 。,31
あたし は 今 何 を し て よ い か わか ら な い 。,15
すぐ に 彼 が 好き に な り ま す よ 。,12
君 は どう し て も 自分 の 思い どおり に し たが る 。,15
仕上が っ た ばかり 。,5
私 は 先週 彼 に お 金 を 払 っ た 。,12
私 たち は 長 い 間 会 っ て い な い 。,13
アメリカ の 家庭 で は 機械 を 用い る こと で 家事 の ほとんど が なくな っ て い る 。,21
この 建物 内 で は たばこ を 吸 っ て は いけ ま せ ん 。,16
もう 少し 忍耐 が あ れ ば 、 きみ は 成功 し た だ ろ う 。,17
彼 の 父 は 医者 で す か 。,9
いつ頃 連絡 を もらえ ま す か 。,8
私 が 家 を 出 る と すぐ 雨 が 降 り だ し た 。,16
耳 を 澄 ま せ て ごらん 。,8
この 地区 で 日本 人 観光 客 に 出くわ す こと は よく あ り ま す 。,18
ウィンブルゾン で 行 わ れ る 男子 と 女子 の シングルス 決勝 は 、 １ 年 で 最も わくわく する 、 そして 最も 人気 の あ る スポーツ 行事 の １ つ で あ る 。,36
君 は 最善 を つ く さ な けれ ば な ら な い 。,15
すぐ に タバコ を 止め なさ い 。,8
彼 は 決して 自分 の 学問 を 誇示 する こと は 無 かっ た 。,15
ダンス が でき な い と は 残念 だ 。,10
この 家 の あ るじ は 私 だ 。,9
彼 の 利害 は 私 と 一致 し な い 。,11
暗 く な っ て き た の で 子供 たち は 家 に 帰 っ た 。,18
ご 用件 を うけ たまわ り ま しょ う か 。,11
私 は 健 に 手伝 っ て くれ る よう に た の ん だ 。,16
彼女 は ９ 時 から 働 く 。,8
彼 ら は すぐ に 仲間 に 頼 る 。,10
彼 は 来る か どう か 疑わし い 。,9
利口 な 学生 達 は 早 く テスト を 終え た 。,12
なん と 美し い 日の出 な の だ ろ う 。,11
する と 、 イエス は 言 わ れ た 。 「 あなた は 私 と 何 の 関係 が あ る の で しょ う 。 女 の 方 。 」,31
この 件 は 君 の 利害 に も 関わ る こと だ 。,13
その 少年 は よく 私 の 家 を 訪れ た もの だっ た 。,14
この 問題 を どう や っ て 扱 い ま しょ う か 。,14
モール の 店 は あまり 好き じゃ な い わ 。,11
この 仕掛け は スイッチ で 動 く 。,8
誰 も が 知 っ て い る が 、 彼 は 彼女 を 好き で 、 彼女 も 彼 が 好き だ 。,24
その 歌手 の 歌 は 心 を な ご ま せ て くれ る 。,15
彼 は きっと 入学 試験 に 合格 する だ ろ う 。,12
これ ら が カイコ が その 葉 を 常食 と する 木 で す 。,15
戦争 中 は 私 たち は 多く の 辛 い 思い を し た 。,15
列車 は 石油 で 走 ら せ る の で す か 。,13
９０ の 約 数 の うち 、 ９ で わり 切れ な い 数 は 何 個 あ る で しょ う か 。,24
彼 は ２ 年 前 海外 へ 行 っ た 。,11
赤ん坊 は 横 に な っ て 眠 っ て い る 。,13
好き な とこ へ 置け よ 。,7
彼 ら は 怠け 者 だ 、 私 は その よう な 人々 は 理解 でき な い 。,19
警察 に 捕ま る よう な 恐れ が あ る の で す か 。,15
人 は 交わ る 仲間 に よ っ て 知 ら れ る と い う こと が でき よう 。,21
まるで なん で も 知 っ て い る よう な 口ぶり だ ね 。,15
それ は 答え にく い 質問 だ 。,8
私 は 、 彼女 に は 子供 っぽ さ が あ る から 、 かえって それ だけ 彼女 が 好き だ 。,22
彼 は 養 っ て い か な けれ ば な ら な い 大 家族 が あ る 。,20
私 は 日曜 日 に いつ も 家 に い る 。,12
規制 緩和 が 進 ん で 、 セルフサービス の ガソリン 給油 は 値段 が 少し 安 く な っ た 。,21
驚き やら 悲しみ やら で 彼女 は 一言 も 言え な かっ た 。,14
紳士 の 人 から お 先 に どうぞ 。,9
性交 の 最中 彼女 は つまら な そう な 顔 を し て い た 。,16
国民 は 歓呼 し て 彼 を 国王 に 迎え た 。,12
先週 ５ 人 の 生徒 が 授業 を 休 ん だ 。,12
最初 の 手紙 の 後 二 通 目 から の 手紙 は すぐ に き た 。,17
君 は 疲れ た 顔 を し て い る 。 １ 、 ２ 時間 休息 す べ き だ 。,21
彼女 は 僕 に 深々 と おじぎ を し た 。,11
うち の 子供 達 は しょっちゅう 小遣い を せが ん で き ま す 。,15
すぐ に 始め た ほう が よ い で しょ う 。,12
その 車 は 急 停車 し た 。,8
仕事 は 速 い ところ 片づけ て 遊 ぼ う 。,11
彼女 は パーティー に 行 き た く て たま ら な かっ た 。,15
今度 遊 び に 来 た とき に 、 君 に その 本 を 見せ ま しょ う 。,19
僕 は 放課 後 に は たいてい 野球 を する 。,11
ピアノ を 弾 く こと が 彼女 の お 気 に 入 り の 気晴らし で す 。,18
また 雨 に な る らし い で す が 。,11
君 は 先生 の 許可 を 受け る べ き だ 。,12
メイド は 客 を 一人一人 大声 で とりつ い た 。,11
彼女 は 遅れ て くる か も しれ ま せ ん 。 其 の 場合 は 待 ち ま す 。,21
私 は 時々 クラブ で 彼 に 会 う 。,10
父 は 煙草 を 止め た 。,7
同社 の 本社 は ロサンゼルス に あ り ま す 。,11
どう い っ た ら よ い か 分か ら な かっ た の で 、 彼 は 黙 っ て い た 。,24
私 は 京都 に 行 っ た 。 そして そこ で たまたま 彼女 に あ っ た 。,18
彼 は ためら わ ず に 分け前 を 取 っ た 。,12
僕 は 寝 る 前 に 探偵 小説 を よく 読 ん だ もの だっ た 。,17
その 新し い 仕事 は 彼 の 技術 を 必要 と し た 。,14
私 が 生き て い る 限り 彼 の こと は 決して 忘れ ま せ ん 。,17
彼 は 不慮 の 死 を 遂げ た 。,9
彼 の 考え は 私 と 同じ だ 。,9
彼 は 自分 の 目 を 信じ る こと が でき な かっ た 。,15
彼 は すばらし い 着想 を 得 て 、 その 機械 を 発明 し た 。,16
今日 、 人間 関係 を 軽視 する 傾向 が あ る よう に 思え る 。,16
冗談 だ と 思 わ れ て は 困 る 。,11
君 は すぐ に 当地 で の 生活 に 慣れ る で しょ う 。,15
私 は 毎日 ８ 時 前 に 家 を 出 ま す 。,13
歯石 を 取 っ て いただ き た い の で す が 。,14
若 い けれど 、 彼 は 大変 信頼 でき る 人物 だ 。,13
彼女 は 昨日 、 病院 に 行 っ た 。,10
この こと は 誰 に も 言 う な 。,10
その 写真 の 何 枚 か は 命懸け で 撮影 さ れ た 。,14
ショー の 入場 料 は ５ ドル で す 。,10
万事 具合 が い い 。,6
彼 は 昨年 ９ 月 に この 学校 に 入学 し た 。,13
やる気 が あ れ ば 英語 は もっと 上達 する 。,11
まず 第 一 に 、 あの 男性 は 誰 で す か 。,13
これ ら の 中 から 選 ぶ わけ で す か 。,12
「 恵子 の 男 関係 が 知 り た い か な 」 「 男 関係 ？ 」 「 誰 と 仲 が 良 い と か 、 誰 と つきあ っ た と か 」,36
病気 で す か 。 顔 が 青白 い よ 。,11
その 仕事 で 大損 し た 。,7
潮 の 全て は ひ く 。,7
彼 ら が なぜ 私 達 に そんな に そんな に 腹 を 立て て い る の か わか ら な い 。,24
彼 ら は 今 、 朝食 を と っ て い る ところ で す 。,16
彼女 は 英語 で よ い 点 を 取 っ た 。,12
君 が 見 て い る あの 絵 は １０ 万 円 する よ 。,15
政府 は 根本 的 な 変革 を し な けれ ば な ら な い 。,16
我々 は 君 から の 便り を 待 っ て い ま す 。,14
高木 さん 、 ゴルフ は や り ま す か 。,11
声 を 聞 い て すぐ ジェーン だ と 分か っ た 。,13
あの 大名 は 十 万 石 を 領 し て い る 。,13
アメリカ の 太平 洋 北西 海岸 沿い に 住 む 原住民 は 、 おそらく アジア から 移住 し た 種族 の 子孫 な の で あ る 。,28
私 は 彼女 に すばらし い 時計 を 買 っ て あげ た 。,14
今日 は 日報 を 書 い て よ 。,9
彼女 は 仕事 が 楽 に な っ た 。,10
当局 は 彼 の 死 に つ い て の 疑惑 を 解き明か そ う と し て い る 。,21
私 の 眼鏡 は どこ で す か 。,9
寒 さ に すぐ に 影響 さ れ る 植物 も あ る 。,14
ヒント の \ * * * * *\ の 数 と 語 の 中 の 字数 と は 関係 が あ り ま せ ん 。,26
彼 は 交通 事故 で 命 を 失 っ た 。,11
盗 ま れ た 金 に 手 を つけ た の は 彼 じゃ な い か と 思 う 。,21
私 は パソコン を 買 う ため に お 金 を ため な けれ ば な ら な い 。,20
どう し て 出生 率 が そんな に 急激 に 減 っ た の だ ろ う か 。,19
マック は 僕 が 掃除 機 を 運 ぶ の を 手伝 っ て くれ た 。,17
彼 の 考え は 時代 の 先 を 行 っ て い た 。,14
私 は 音楽 に 熱中 し て い た 。,10
彼 は 昨年 転校 し た 。,7
彼女 は メアリー と 名付け られ た 。,8
私 の ため に お 心遣い と お 骨折り くださ り 、 ありがとう ござ い ま す 。,18
予約 を 変更 し た い の で す が 。,11
彼 を 信 じ た あなた が どう か し て い た の よ 。,16
私 達 の 時代 に 戻 る に は どう や っ た ら い い の ？,18
これ は 今 まで 見 た 中 で 一番 かわい い 赤ちゃん で す 。,15
左 から ５ 人 目 の 男 に キス し なさ い 。,13
今日 は タバコ を 吸 う 気 が し な い 。,12
彼女 は 列車 に 乗 り 遅れ な い か と 心配 し た 。,15
何 か 重 い 兇器 で や ら れ た らし く 、 頭蓋 骨 は 粉砕 さ れ た 。,21
ムーリエル が 貼 っ た リンク は もう 二 度 と クリック する もん か 。,16
なぜ あなた は 彼 に そんな に 批判 的 な の か 、 私 に は 理解 でき な い 。,21
彼 は 二 度 と 故郷 に 帰れ な い 運命 に あ っ た 。,16
エンジン が 故障 し た 。,6
この 箱 に は りんご が いっぱい で す 。,10
不思議 に も 彼 は 結局 その 試験 に 合格 し た 。,13
牛 は 私 達 に 必要 な もの を たくさん 与え て くれ る 。,15
「 ４ ポンド ５０ ペンス 」 と ボブ が 言 う 。,12
私 は 手あたり 次第 に 小説 を 読 ん だ もの だ 。,13
私 は よく そう し た 感情 に 襲 わ れ た 。,13
その 声 を 聞 い て 私 は 母 を 思い出 し た 。,14
今夜 は 月 が 明る く 輝 い て い る 。,12
この 機械 は 扱い やす い 。,7
講堂 は 心配 そう な 志願 者 で 満員 で あ る 。,13
昨日 食べ た もの が あた っ た 。,9
彼 は 彼女 を し かっ た 。,8
きみ が なぜ ジャズ を 嫌い か 私 に は わか ら な い 。,15
彼女 の 顔つき が 喜び を 表 し た 。,10
それ は 秘密 で す 。 誰 に も もら す こと が あ っ て は いけ ま せ ん 。,22
ポーラ は 明日 車 を 洗 う つもり で す 。,11
我々 は 秋 に 夏 の 穀物 を 収穫 し ま す 。,13
その 貧し い 一家 は 毎月 その 日暮らし で 生活 し て い る 。,15
ご 遠慮 さ せ て くださ い 。,8
この ドレス を 着 た ほう が すてき に 見え る 。,12
その 二人 の 少年 は 英語 の 力 が ほとんど 同じ だ 。,13
寒 さ を もの と も せ ず に 、 彼 は 薄着 で 外出 し た 。,18
彼 の 無礼 な 返事 に 彼女 は かっと な っ て 彼 の 顔 を ぴしゃり と たた い た 。,22
イギリス は 、 長 い 間 私 が 訪問 し た い と 思 っ て い た 国 で す 。,22
母 は 大抵 大変 忙し かっ た 。,8
回数 券 を 下さ い 。,6
先生 は トム が 試験 に 合格 する だ ろ う と 結論 付け た 。,16
お前 、 仕事 し すぎ だ よ 。,8
私 は 他人 の 前 で 嘲笑 さ れ る の に 耐え られ な い 。,17
１ 月 の 輸出 は １００ 億 ドル と 、 同月 と し て は 最高 記録 に な っ た 。,22
彼 は 野球 だけ で は な く フットボール も 好き だ 。,13
此処 から 出 し て く れ 。,8
